[
  {
    "summary_key": "detachment:d-armoured-trailblazers:sagitaur-spearhead",
    "detachment_id": "d-armoured-trailblazers",
    "name": "Sagitaur Spearhead",
    "summary": "Friendly Sagitaur units gain Scouts 6\".",
    "review_state": "approved",
    "mechanic_digest": "d60a8c1a17fba999afad3428835d927a",
    "reviewed_by": "claude-opus-5-adversarial-reviewer",
    "reviewed_at": "2026-08-06T00:00:00Z"
  },
  {
    "summary_key": "detachment:d-brandfast-oathband:mobile-sensor-relays",
    "detachment_id": "d-brandfast-oathband",
    "name": "Mobile Sensor Relays",
    "summary": "Leagues of Votann Transports grant Sustained Hits 1 to a friendly Infantry unit's ranged weapons while that unit is wholly within 6\" of the Transport.",
    "review_state": "approved",
    "mechanic_digest": "6fa2b4d99282480398af90b97cb8cca4",
    "reviewed_by": "claude-opus-5-adversarial-reviewer",
    "reviewed_at": "2026-08-06T00:00:00Z"
  },
  {
    "summary_key": "detachment:d-delve-assault-shift:fury-from-the-delve",
    "detachment_id": "d-delve-assault-shift",
    "name": "Fury From The Dêlve",
    "summary": "Cthonian Beserks units from your army have the Deep Strike ability. Cthonian Beserks units from your army gain the BATTLELINE keyword.",
    "review_state": "approved",
    "mechanic_digest": "bfb9ff60a30ac7b5237829d781a9e5fd",
    "reviewed_by": "claude-sonnet-5-reviewer",
    "reviewed_at": "2026-09-15T04:35:16Z"
  },
  {
    "summary_key": "detachment:d-farseekers:eye-of-the-hunt",
    "detachment_id": "d-farseekers",
    "name": "Eye of the Hunt",
    "summary": "Hernkyn units' ranged attacks against targets within 12\" gain +1 to hit rolls.",
    "review_state": "approved",
    "mechanic_digest": "32539337620b77d47313094a59d65393",
    "reviewed_by": "claude-opus-5-adversarial-reviewer",
    "reviewed_at": "2026-08-06T00:00:00Z"
  },
  {
    "summary_key": "detachment:d-hearthband:methodical-annihilation",
    "detachment_id": "d-hearthband",
    "name": "Methodical Annihilation",
    "summary": "A Leagues of Votann model attacking the closest eligible target, or one within its unit's Engagement Range, re-rolls a Wound roll of 1; if its unit is Kahl, Einhyr Hearthguard or Uthar the Destined, that attack gets +1 Armour Penetration.",
    "review_state": "approved",
    "mechanic_digest": "6b6021e37b10e328e5a2f09c46816108",
    "reviewed_by": "claude-opus-5-second-reviewer",
    "reviewed_at": "2026-08-06T00:00:00Z"
  },
  {
    "summary_key": "detachment:d-hearthfyre-arsenal:optimal-application",
    "detachment_id": "d-hearthfyre-arsenal",
    "name": "Optimal Application",
    "summary": "End of your Command phase, gain 1YP per objective held outside your deployment zone within range of an Iron-Master or Memnyr Strategist, max 2YP. Spend 1YP when a Brokhyr, Ironkin Steeljacks or Arkanyst Evaluator shoots to re-roll Hit 1s.",
    "review_state": "approved",
    "mechanic_digest": "9bdd1a856a1a5041b14a0673f34b52ec",
    "reviewed_by": "claude-opus-5-second-reviewer",
    "reviewed_at": "2026-08-06T00:00:00Z"
  },
  {
    "summary_key": "detachment:d-hearthguard-covenant:avatars-of-the-ancestors",
    "detachment_id": "d-hearthguard-covenant",
    "name": "Avatars of the Ancestors",
    "summary": "Kahl, Einhyr Champion, Einhyr Hearthguard and Uthar the Destined units re-roll wound rolls of 1 on ranged attacks against targets within 9\". Cannot be combined with another Hearthguard detachment.",
    "review_state": "approved",
    "mechanic_digest": "c1866357297c667fa46a34d137dc63eb",
    "reviewed_by": "claude-opus-5-adversarial-reviewer",
    "reviewed_at": "2026-08-06T00:00:00Z"
  },
  {
    "summary_key": "detachment:d-mercenary-oathband:ruthless-reinvestment",
    "detachment_id": "d-mercenary-oathband",
    "name": "Ruthless Reinvestment",
    "summary": "Replaces the army rule's automatic switching: units start the battle with Hostile Acquisition, and each Command phase you can spend 3YP to swap all your units between Hostile Acquisition and Fortify Takeover.",
    "review_state": "approved",
    "mechanic_digest": "12230f63ac15579dde8a26517513b037",
    "reviewed_by": "claude-opus-5-adversarial-reviewer",
    "reviewed_at": "2026-08-06T00:00:00Z"
  },
  {
    "summary_key": "detachment:d-needgaard-oathband:martial-leverage",
    "detachment_id": "d-needgaard-oathband",
    "name": "Martial Leverage",
    "summary": "Gain 1 Yield Point each time an enemy unit is destroyed.",
    "review_state": "approved",
    "mechanic_digest": "243433b925bd8889ad11d05b5e4beb28",
    "reviewed_by": "claude-opus-5-adversarial-reviewer",
    "reviewed_at": "2026-08-06T00:00:00Z"
  },
  {
    "summary_key": "detachment:d-persecution-prospect:assailed-from-every-angle",
    "detachment_id": "d-persecution-prospect",
    "name": "Assailed From Every Angle",
    "summary": "When selected to shoot, a unit can name one enemy unit (not Monster/Vehicle) as its only target that phase; if any attack hits, that enemy is assailed until your next Shooting phase, or also pinned (-2\" Move, -2 Charge) if already assailed.",
    "review_state": "approved",
    "mechanic_digest": "436d6a65a9be30f5cc1f22a98949d489",
    "reviewed_by": "claude-opus-5-second-reviewer",
    "reviewed_at": "2026-08-06T00:00:00Z"
  }
]
