[
  {
    "summary_key": "detachment:d-covenite-coterie:stitchflesh-abominations",
    "detachment_id": "d-covenite-coterie",
    "name": "Stitchflesh Abominations",
    "summary": "Attacks against your Haemonculus Covens units suffer -1 to the wound roll whenever the attacker's Strength exceeds that unit's Toughness.",
    "review_state": "approved",
    "mechanic_digest": "5bf7e6847aee0930b5ee86d5414aed5b",
    "reviewed_by": "claude-opus-5-adversarial-reviewer",
    "reviewed_at": "2026-08-06T00:00:00Z"
  },
  {
    "summary_key": "detachment:d-exhibition-of-slaughter:exacting-cruelty",
    "detachment_id": "d-exhibition-of-slaughter",
    "name": "Exacting Cruelty",
    "summary": "Wych Cult units' melee attacks gain Lethal Hits against non-Monster, non-Vehicle targets. This detachment cannot be combined with another Wych Cult detachment.",
    "review_state": "approved",
    "mechanic_digest": "a88608eed1dd68f8aa7471bf7420e936",
    "reviewed_by": "claude-opus-5-adversarial-reviewer",
    "reviewed_at": "2026-08-06T00:00:00Z"
  },
  {
    "summary_key": "detachment:d-kabalite-agonysts:contracted-harvest",
    "detachment_id": "d-kabalite-agonysts",
    "name": "Contracted Harvest",
    "summary": "Friendly Blades for Hire and Kabal units' ranged attacks gain Sustained Hits 1 against non-Monster, non-Vehicle targets. Exclusive Kabal-tagged detachment.",
    "review_state": "approved",
    "mechanic_digest": "12315f2c9eeecf1dfb4cfe2e9c8cb64b",
    "reviewed_by": "claude-opus-5-adversarial-reviewer",
    "reviewed_at": "2026-08-06T00:00:00Z"
  },
  {
    "summary_key": "detachment:d-kabalite-cartel:murderous-agenda",
    "detachment_id": "d-kabalite-cartel",
    "name": "Murderous Agenda",
    "summary": "At the start of battle pick a Contract and a matching enemy unit: Kabal and Blades for Hire get Precision on it, or Sustained Hits 1 versus all Infantry/Mounted, or Lethal Hits versus all Monsters/Vehicles. Killing it pays 3 Pain tokens.",
    "review_state": "in_review",
    "mechanic_digest": "76884b94554df67cd86a80d1300e0e6b"
  },
  {
    "summary_key": "detachment:d-realspace-raiders:alliance-of-agony",
    "detachment_id": "d-realspace-raiders",
    "name": "Alliance of Agony",
    "summary": "At battle start, gain 2 Pain tokens for each qualifying character-and-unit-type pairing in your army (Archon/Kabalite Warriors, Succubus/Wyches, Haemonculus/Wracks), stacking up to 6.",
    "review_state": "approved",
    "mechanic_digest": "52c74dc4f06826867b84995f2eb18d0a",
    "reviewed_by": "claude-opus-5-adversarial-reviewer",
    "reviewed_at": "2026-08-06T00:00:00Z"
  },
  {
    "summary_key": "detachment:d-reapers-wager:callous-competition",
    "detachment_id": "d-reapers-wager",
    "name": "Callous Competition",
    "summary": "Drukhari start winning the wager; each kill flips it to the killer. Winners re-roll Hit rolls of 1, losers re-roll Hit and Wound rolls of 1. Take up to 500/1000/1500 pts of Harlequins, never Warlord; no Corsairs and Travelling Players.",
    "review_state": "in_review",
    "mechanic_digest": "edc8771548a5d3a17d8ebd533d3a387d"
  },
  {
    "summary_key": "detachment:d-skysplinter-assault:rain-of-cruelty",
    "detachment_id": "d-skysplinter-assault",
    "name": "Rain Of Cruelty",
    "summary": "Whenever a Drukhari unit disembarks from a Transport, its ranged weapons gain Ignores Cover and its melee weapons gain Lance until end of turn.",
    "review_state": "approved",
    "mechanic_digest": "bbedff71f84a8da8f148d97bddda8414",
    "reviewed_by": "claude-opus-5-adversarial-reviewer",
    "reviewed_at": "2026-08-06T00:00:00Z"
  },
  {
    "summary_key": "detachment:d-spectacle-of-spite:combat-drugs",
    "detachment_id": "d-spectacle-of-spite",
    "name": "Combat Drugs",
    "summary": "At the start of your Command phase take one Combat Drug, no repeats, or roll 2D6 for two; until your next Command phase Wych Cult models get +1 melee Attacks, +2\" Move, +1 melee WS, +1 Toughness, +1 melee Strength, or +1 Ld and ranged BS.",
    "review_state": "in_review",
    "mechanic_digest": "a2889e27e39f1fc22c21af2c3c98a602"
  },
  {
    "summary_key": "detachment:d-tools-of-torment:darkest-artifice",
    "detachment_id": "d-tools-of-torment",
    "name": "Darkest Artifice",
    "summary": "Attacks against friendly Cronos or Talos units from a higher-Strength attacker get -1 to wound. Exclusive Covens-tagged detachment.",
    "review_state": "approved",
    "mechanic_digest": "00e47a59c012eb070b7b0a1598e953b8",
    "reviewed_by": "claude-opus-5-adversarial-reviewer",
    "reviewed_at": "2026-08-06T00:00:00Z"
  }
]
